اسم المنتج,الوصف القصير,الوصف الكامل,السعر,العملة,الكمية,الصورة,التصنيف,الحالة,المتغر,الباركود,الوزن
"مانفيرت استميولانت 1 لتر ","مانفيرت استميولايت احماض امينية 1 لتر- استفد من تركيبته الفعالة فأقصى استفادة منه تزيد نمو نباتاتك و","مانفيرت استميولايت احماض امينية 1 لتر- استفد من تركيبته الفعالة فأقصى استفادة منه تزيد نمو نباتاتك وتقوم بالتطور الصحي والحصول علي جودة مضمونة للنباتات في مزرعتك وتعزيز النمو | شركة تاج الزراعية",51.75,SAR,100,"https://media.zid.store/thumbs/7de0e23a-34de-4534-a0e6-ecf31aab83f7/635435bf-abaa-4eef-958e-05c79d2a07a5-thumbnail-1000x1000.png","",1,"","1100047",""
"مانفيرت فوليكين 5 لتر","محفزات حيوية تحتوي هرمونات وإنزيمات وفيتامينات واحماض امينية وبروتينات مع مضادات الأكسدة ومشتقات احا","محفزات حيوية تحتوي هرمونات وإنزيمات وفيتامينات واحماض امينية وبروتينات مع مضادات الأكسدة ومشتقات احادية السكريات | أسمدة زراعية، شركة تاج الزراعية",460.00,SAR,100,"https://media.zid.store/thumbs/7de0e23a-34de-4534-a0e6-ecf31aab83f7/fa458efb-acfe-418f-bf57-f0fc917ffee8-thumbnail-1000x1000.png","",1,"","1100053",""
"سويل ايكو 20 لتر","سويل ايكو يحتوي على ايونات الكالسيوم الأنشطة التي تعمل على إزاحة ايونات الصوديوم في التربة الزراعية ","سويل ايكو يحتوي على ايونات الكالسيوم الأنشطة التي تعمل على إزاحة ايونات الصوديوم في التربة الزراعية وبذلك يحرر العناصر المعدنية ويتمكن النبات من امتصاصها والاستفادة منها",402.50,SAR,100,"https://media.zid.store/thumbs/7de0e23a-34de-4534-a0e6-ecf31aab83f7/0e1e641a-0b9c-4866-b159-1a2567d98796-thumbnail-1000x1000.png","",1,"","1100050",""
"فوسيكا 1لتر","سماد سائل مانفيرت فوسيكا، شركة بايوفيرت الإسبانية، منتج جهازي يتحرك ضمن النبات خلال الخشب واللحاء من","سماد سائل مانفيرت فوسيكا، شركة بايوفيرت الإسبانية، منتج جهازي يتحرك ضمن النبات خلال الخشب واللحاء من الأوراق إلى الجذور وبالعكس | أسمدة سائلة، شركة تاج الزراعية",69.00,SAR,100,"https://media.zid.store/thumbs/7de0e23a-34de-4534-a0e6-ecf31aab83f7/ec431ec2-e42c-4629-a60f-5f21fae0f1b8-thumbnail-1000x1000.png","",1,"","1100046",""
"موفيلي كالسيوم  5 كيلو","فوسيكا من تاج للزراعة، المنتج الاستثنائي لتحسين صحة النباتات وزيادة إنتاجيتها استفد من تركيبة فريدة ","فوسيكا من تاج للزراعة، المنتج الاستثنائي لتحسين صحة النباتات وزيادة إنتاجيتها استفد من تركيبة فريدة تعزز النمو وتقاوم الأمراض | أسمدة عضوية، شركة تاج الزراعية",690.00,SAR,100,"https://media.zid.store/thumbs/7de0e23a-34de-4534-a0e6-ecf31aab83f7/093f3840-653d-4d3c-a49e-7139a68268e7-thumbnail-1000x1000.png","",1,"","1100001",""
"نبتة B1+ B2+A","احصل على مجموعة اسمدة نبتة  الآن من تاج الزراعية فقط، اسمدة نبتة 3 عبوات | تاج الزراعية","احصل على مجموعة اسمدة نبتة  الآن من تاج الزراعية فقط، اسمدة نبتة 3 عبوات | تاج الزراعية",99.00,SAR,100,"https://media.zid.store/thumbs/7de0e23a-34de-4534-a0e6-ecf31aab83f7/b5367aa8-db7b-4574-b08b-0909ff851776-thumbnail-1000x1000-70.jpg","",1,"","Z.68552.1644166183884004",""
"سيلا جرون تيرا 20 لتر","سيلا جرون تيرا - ابدأ في تحسين زراعتك وزيادة إنتاجيتك مع منتج من شركة بايوفيرت الإسبانية يضاف للتربة","سيلا جرون تيرا - ابدأ في تحسين زراعتك وزيادة إنتاجيتك مع منتج من شركة بايوفيرت الإسبانية يضاف للتربة من أجل تحسين خواص التربة الفيزيائية والكيميائية والحيوية | الأسمدة السائلة، شركة تاج الزراعية",368.00,SAR,100,"https://media.zid.store/thumbs/7de0e23a-34de-4534-a0e6-ecf31aab83f7/df8b49be-bcfb-4253-a79a-efcc6654d8f3-thumbnail-1000x1000.png","",1,"","1100049",""
"كالسيوم بورون تراكر 5 لتر","سماد كالسيوم بورون تراكر من تاج الزراعية, اكسيد كالسيوم10،%بورون1،%جلوكونيك اسيد 2.24 %","سماد كالسيوم بورون تراكر من تاج الزراعية, اكسيد كالسيوم10،%بورون1،%جلوكونيك اسيد 2.24 %",178.25,SAR,100,"https://media.zid.store/thumbs/7de0e23a-34de-4534-a0e6-ecf31aab83f7/1dbd3d3d-a7a5-41b3-8797-6293b9d27227-thumbnail-1000x1000.png","",1,"","1100051",""
"يوريا محبب","يوريا محببة ذات جودة ممتازة للاستخدام في التسميد الزراعي. يعتبر اليوريا مصدرًا هامًا للنيتروجين الذي","يوريا محببة ذات جودة ممتازة للاستخدام في التسميد الزراعي. يعتبر اليوريا مصدرًا هامًا للنيتروجين الذي يساهم في نمو النباتات | أسمدة زراعية، شركة تاج الزراعية",132.00,SAR,100,"https://media.zid.store/thumbs/7de0e23a-34de-4534-a0e6-ecf31aab83f7/2e70b7a2-db25-4668-ba1c-f5f9cb4708fd-thumbnail-1000x1000.png","",1,"","1200200006",""
"مبيد فطري ويتسلف 80% 1 كيلو","مبيد فطري غير جهازي على هيئة حبيبات قابلة للانتشار ( كبريت ميكروني) من تاج الزراعية، يستخدم كمبيد وق","مبيد فطري غير جهازي على هيئة حبيبات قابلة للانتشار ( كبريت ميكروني) من تاج الزراعية، يستخدم كمبيد وقائي وعلاجي | مبيدات فطرية، شركة تاج الزراعية",25.00,SAR,100,"https://media.zid.store/thumbs/7de0e23a-34de-4534-a0e6-ecf31aab83f7/cc662d61-439e-49c7-b8ba-0be374473cc3-thumbnail-1000x1000.png","",1,"","3400013",""
"تلي ماسترمبيد عشبي 5 لتر","مبيد اعشاب عام من تاج الزراعية، لمكافحة الاعشاب الرفيعة وعريضة الاوراق الحولية والمعمرة في حقول اشجا","مبيد اعشاب عام من تاج الزراعية، لمكافحة الاعشاب الرفيعة وعريضة الاوراق الحولية والمعمرة في حقول اشجار الفاكهة والنخيل والاراضي | مبيدات أعشاب، شركة تاج الزراعية",172.50,SAR,100,"https://media.zid.store/thumbs/7de0e23a-34de-4534-a0e6-ecf31aab83f7/70079ef2-65b6-43f8-9468-ddf5d0b567b3-thumbnail-1000x1000-70.jpg","",1,"","3100004",""
"اكياس عنب مقاس 25×35","ذا كنت تبحث عن اكياس عنب لحماية زرعك من أي عوامل ضارة مثل الآفات الضارة أو العوامل البيئية المفاجئة ","ذا كنت تبحث عن اكياس عنب لحماية زرعك من أي عوامل ضارة مثل الآفات الضارة أو العوامل البيئية المفاجئة فيمكنك الحصول عليها الآن من خلال متجرنا تاج الزراعية",0.35,SAR,100,"https://media.zid.store/thumbs/7de0e23a-34de-4534-a0e6-ecf31aab83f7/3252975c-1d35-4de0-a5ec-65b045d15f8d-thumbnail-1000x1000.png","",1,"","4200074",""
"كى بى اس 1 لتر","سماد عضوي يؤثر بشكل إيجابي على لون وحجم الثمار ويزيد من محتواها من السكريات يحتوي على عنصر الكبريت ا","سماد عضوي يؤثر بشكل إيجابي على لون وحجم الثمار ويزيد من محتواها من السكريات يحتوي على عنصر الكبريت الهام للتربة والنبات | أسمدة عضوية، شركة تاج الزراعية",40.00,SAR,100,"https://media.zid.store/thumbs/7de0e23a-34de-4534-a0e6-ecf31aab83f7/c1de86dd-3168-452e-9752-b943f5d7f94c-thumbnail-1000x1000.png","",1,"","1200300015",""
"جبس زراعي 25 كيلو","جبس زراعي عالي الجودة يلعب دور في معالجة ملوحة التربة وطرد عنصر الصوديوم من مكان انتشار الجذور، كما ","جبس زراعي عالي الجودة يلعب دور في معالجة ملوحة التربة وطرد عنصر الصوديوم من مكان انتشار الجذور، كما يخفض قلوية التربة وتحسين امتصاص جذور النبات | أسمدة زراعية، شركة تاج الزراعية",28.75,SAR,100,"https://media.zid.store/thumbs/7de0e23a-34de-4534-a0e6-ecf31aab83f7/f690f547-d9a4-4242-ae1e-b2000c035e01-thumbnail-1000x1000.png","",1,"","1200100041",""
"سلفات المغنيسيوم","اجعل نباتاتك تزهر بجمال, سلفات المغنيسيوم للنبات تحفز النمو بسرعة وتحسن لون الأوراق والجذور وتعزز ام","اجعل نباتاتك تزهر بجمال, سلفات المغنيسيوم للنبات تحفز النمو بسرعة وتحسن لون الأوراق والجذور وتعزز امتصاص العناصر الغذائية من شركة تاج الزراعية.",74.75,SAR,100,"https://media.zid.store/thumbs/7de0e23a-34de-4534-a0e6-ecf31aab83f7/139be4c9-282a-4468-9797-1797b686382e-thumbnail-1000x1000-70.jpg","",1,"","1100032",""
"كبريت تعفير 25 كيلو","كبريت زراعي تعفير, مبيد فطري طبيعي يُستخدم للوقاية ومكافحة الأمراض الفطرية في النباتات. يتم استخدامه","كبريت زراعي تعفير, مبيد فطري طبيعي يُستخدم للوقاية ومكافحة الأمراض الفطرية في النباتات. يتم استخدامه عن طريق رشه على النباتات | مبيدات فطرية، شركة تاج الزراعية",100.00,SAR,100,"https://media.zid.store/thumbs/7de0e23a-34de-4534-a0e6-ecf31aab83f7/50047588-f7b2-4304-ad7c-2bbf2501f9ec-thumbnail-1000x1000-70.webp","",1,"","1200100034",""
"دلتامك ابامكتين 1.8 مبيد عناكب لتر","مبيد ابامكتين 1.8 مبيد طبيعي للعناكب هو الحل الطبيعي الفعّال لمكافحة العناكب والآفات في الزراعة والح","مبيد ابامكتين 1.8 مبيد طبيعي للعناكب هو الحل الطبيعي الفعّال لمكافحة العناكب والآفات في الزراعة والحدائق. يعتبر هذا المبيد خيارًا مميزًا للمزارعين",65.00,SAR,100,"https://media.zid.store/thumbs/7de0e23a-34de-4534-a0e6-ecf31aab83f7/c4d26b04-3515-41b6-b379-be49fa51ed4f-thumbnail-1000x1000-70.jpg","",1,"","3200060",""
"اكياس تشتيل 15×30 ","أكياس التشتيل بحجم 25 كيلوغرام هي أكياس خاصة تُستخدم في عملية التشتيل للنباتات. تُستخدم هذه الأكياس ","أكياس التشتيل بحجم 25 كيلوغرام هي أكياس خاصة تُستخدم في عملية التشتيل للنباتات. تُستخدم هذه الأكياس لزراعة النباتات الصغيرة | أكياس وخيوط، شركة تاج الزراعية",200.00,SAR,100,"https://media.zid.store/thumbs/7de0e23a-34de-4534-a0e6-ecf31aab83f7/e4437951-d28b-4bc8-87f4-73752a16580a-thumbnail-1000x1000-70.jpg","",1,"","Z.68552.16275013805195966",""
"امينو ستار 1 لتر","أمينو ستار من تاج للزراعة، المنتج الفعال والمبتكر لتعزيز صحة النباتات وتعزيز نموها بشكل استثنائي | أ","أمينو ستار من تاج للزراعة، المنتج الفعال والمبتكر لتعزيز صحة النباتات وتعزيز نموها بشكل استثنائي | أسمدة عضوية، شركة تاج الزراعية",25.00,SAR,100,"https://media.zid.store/thumbs/7de0e23a-34de-4534-a0e6-ecf31aab83f7/eb0ac430-1faa-4799-8004-14d22c19e316-thumbnail-1000x1000.png","",1,"","1200100021",""
"امينو كالسيوم 1 لتر","يحتوي على عنصر الكالسيوم والبورون بصورة سهلة وميسرة الامتصاص من قبل النباتات، محمل على الأحماض الامي","يحتوي على عنصر الكالسيوم والبورون بصورة سهلة وميسرة الامتصاص من قبل النباتات، محمل على الأحماض الامينية | الزراعة المائية، شركة تاج الزراعية",25.00,SAR,100,"https://media.zid.store/thumbs/7de0e23a-34de-4534-a0e6-ecf31aab83f7/9532fa8c-cef7-4d29-8448-3e67009c003e-thumbnail-1000x1000.png","",1,"","1200100022",""
"سولت فري 1 لتر","سولت فري 1 لتر -هو سماد عضوي يقوم على معالجة ملوحة التربة الناتجة عن وجود الاملاح , فهو حلا مثاليًا ","سولت فري 1 لتر -هو سماد عضوي يقوم على معالجة ملوحة التربة الناتجة عن وجود الاملاح , فهو حلا مثاليًا للمحافظة على توازن التربة وجودة محاصيلك |شركة تاج الزراعية",20.00,SAR,100,"https://media.zid.store/thumbs/7de0e23a-34de-4534-a0e6-ecf31aab83f7/15cb396d-acd0-4409-b192-05d6c417726e-thumbnail-1000x1000.png","",1,"","1200100024",""
"مجموعة أدوات الحديقة 10 قطع","مجموعة أدوات وتجهيزات الحديقة من تاج الزراعية، شديدة التحمل من الفولاذ المقاوم للصدأ من سكودلس 10 قط","مجموعة أدوات وتجهيزات الحديقة من تاج الزراعية، شديدة التحمل من الفولاذ المقاوم للصدأ من سكودلس 10 قطع، مع مقبض مطاطي مانع للانزلاق | مستلزمات الحدائق، شركة تاج الزراعية",74.75,SAR,100,"https://media.zid.store/thumbs/7de0e23a-34de-4534-a0e6-ecf31aab83f7/bd8ee837-69cf-4316-a3b6-39a3f31338fe-thumbnail-1000x1000-70.jpg","",1,"","4100011",""
"مجموعة أدوات الحديقة للاطفال 8 قطع","تعتبر هواية الزراعة من الهوايات المميزة التي يجب عليك إثراء قيمتها لدى أطفالك، ومن خلال الحصول على ا","تعتبر هواية الزراعة من الهوايات المميزة التي يجب عليك إثراء قيمتها لدى أطفالك، ومن خلال الحصول على ادوات اطفال للحديقة فيمكنك تعليم أطفالك هذه الهواية الممتعة والاستمتاع معهم في أوقات فراغهم",46.00,SAR,100,"https://media.zid.store/thumbs/7de0e23a-34de-4534-a0e6-ecf31aab83f7/68d45ae4-2ff8-4057-9bcb-6b7d11988d3d-thumbnail-1000x1000-70.jpg","",1,"","4100014",""
"مجموعة أدوات الحديقة 13 قطعة","مجموعة أدوات الحديقة من تاج الزراعية، شديدة التحمل من الفولاذ المقاوم للصدأ من سكودلس 13 قطع، مع مقب","مجموعة أدوات الحديقة من تاج الزراعية، شديدة التحمل من الفولاذ المقاوم للصدأ من سكودلس 13 قطع، مع مقبض مطاطي مانع للانزلاق | مستلزمات زراعية، شركة تاج الزراعية",85.10,SAR,100,"https://media.zid.store/thumbs/7de0e23a-34de-4534-a0e6-ecf31aab83f7/df321ab6-edde-422a-8ab2-628953d6ae4d-thumbnail-1000x1000-70.jpg","",1,"","4100013",""
"رول قماش زراعي ابيض الطول 400 متر   العرض 3 متر","رول قماش زراعي, لفة من القماش الخاص بالزراعة. يُستخدم هذا النوع من القماش الزراعي للعديد من الأغراض ","رول قماش زراعي, لفة من القماش الخاص بالزراعة. يُستخدم هذا النوع من القماش الزراعي للعديد من الأغراض في الزراعة والبستنة، ويمتاز بالمرونة والمتانة وطول 400 متر",360.00,SAR,100,"https://media.zid.store/thumbs/7de0e23a-34de-4534-a0e6-ecf31aab83f7/016ea0a5-de9d-48b6-af9f-c0c542d75645-thumbnail-1000x1000-70.webp","",1,"","4200142",""
"مرشة ايطالي 22 لتر","لها استخدامات واسعة سواء زراعية لرش المبيدات الحشرية أو استخدامات منزلية لرش الماء، تصلح لرش نباتات ","لها استخدامات واسعة سواء زراعية لرش المبيدات الحشرية أو استخدامات منزلية لرش الماء، تصلح لرش نباتات الزينة في المنزل | مرشات زراعية، شركة تاج الزراعية",180.00,SAR,100,"https://media.zid.store/thumbs/7de0e23a-34de-4534-a0e6-ecf31aab83f7/6b8b312a-f9c4-42be-8c85-f5aa253764f8-thumbnail-1000x1000-70.jpg","",1,"","4200027",""
"مرشة ايطالي 10 لتر","مرشة إيطالية سعة 10 لتر، مع فوهة الرش قابلة للتعديل للرش الناعم والمركز، بالاضافة الى رداد للمحافظة ","مرشة إيطالية سعة 10 لتر، مع فوهة الرش قابلة للتعديل للرش الناعم والمركز، بالاضافة الى رداد للمحافظة على ضغط الهواء بداخلها لفترات طويلة | مرشات، شركة تاج الزراعية",110.00,SAR,100,"https://media.zid.store/thumbs/7de0e23a-34de-4534-a0e6-ecf31aab83f7/a751e7cf-a172-4609-8e10-628ac44c7ae5-thumbnail-1000x1000-70.jpg","",1,"","4200024",""
"مرشة ايطالي 5 لتر","مرشة إيطالية سعة 5 لتر مرشة ايطالي 5لترصنع في ايطاليامنتج عملي مصنع من اجود انواع البلاستيك والمواد ","مرشة إيطالية سعة 5 لتر مرشة ايطالي 5لترصنع في ايطاليامنتج عملي مصنع من اجود انواع البلاستيك والمواد الصديقة للبيئة | مرشات زراعية، شركة تاج الزراعية",90.00,SAR,100,"https://media.zid.store/thumbs/7de0e23a-34de-4534-a0e6-ecf31aab83f7/ce958dba-9b72-4729-b454-436077f1afa1-thumbnail-1000x1000-70.jpg","",1,"","4200028",""
"مرشة ايطالي 2 لتر","مرشة ايطالي 2 لتر عالية الجودة، مع فوهة الرش قابلة للتعديل للرش الناعم والمركز و رداد للمحافظة على ض","مرشة ايطالي 2 لتر عالية الجودة، مع فوهة الرش قابلة للتعديل للرش الناعم والمركز و رداد للمحافظة على ضغط الهواء بداخلها | مرشات زراعية، شركة تاج الزراعية",29.90,SAR,100,"https://media.zid.store/thumbs/7de0e23a-34de-4534-a0e6-ecf31aab83f7/8a289178-278a-4f46-a0e5-c8bb148230a2-thumbnail-1000x1000-70.jpg","",1,"","4200025",""
"سقايات طيور 14 لتر","تعتبر سقايات طيور من أهم الأدوات التي يجب توفيرها في حديقتك أو مزرعتك وخصوصًا إذا كنت تمتلك الكثير م","تعتبر سقايات طيور من أهم الأدوات التي يجب توفيرها في حديقتك أو مزرعتك وخصوصًا إذا كنت تمتلك الكثير من الطيور، ويمكنك الآن شرائها بحجم ممتاز من خلال متجرنا تاج الزراعية، اغتنم الفرصة",18.00,SAR,100,"https://media.zid.store/thumbs/7de0e23a-34de-4534-a0e6-ecf31aab83f7/0c07a3a0-1f74-4d0e-a79e-6d03526baae1-thumbnail-1000x1000.png","",1,"","4200001",""
"كلاش مبيد الحشرات 1لتر","كلاش 25 اس سي مبيد حشري من تاج الزراعية، مبيد حشري غير جهازي يعمل بالملامسة وعن طريق المعدة له تاثير","كلاش 25 اس سي مبيد حشري من تاج الزراعية، مبيد حشري غير جهازي يعمل بالملامسة وعن طريق المعدة له تاثير صاعق وذو اثر باقي طويل | مبيدات حشرية، شركة تاج الزراعية",50.00,SAR,100,"https://media.zid.store/thumbs/7de0e23a-34de-4534-a0e6-ecf31aab83f7/3ff3abb0-da09-4a88-a5fe-f4f17be7b5e4-thumbnail-1000x1000-70.jpg","",1,"","3300017",""
"محطة طعوم لمكافحة الفئران والجرذان","محطة طعوم لمكافحة الفئران والجرذان مصنوعة من اجود انواع البلاستيك المقاوم للحرارة، يوضع بها الطعم ال","محطة طعوم لمكافحة الفئران والجرذان مصنوعة من اجود انواع البلاستيك المقاوم للحرارة، يوضع بها الطعم القاتل للفئران ويغلق عليها بالمفتاح لسلامة الاطفال | مبيدات حشرية، شركة تاج الزراعية",30.00,SAR,100,"https://media.zid.store/thumbs/7de0e23a-34de-4534-a0e6-ecf31aab83f7/5c555cca-0ffe-47c3-b06b-a8c9eee6777d-thumbnail-1000x1000-70.jpg","",1,"","4100015",""
"ماكس فورس SC جل لمكافحة الصراصير 20 جرام","ماكس فورس إس سي جل هو منتج فعال وقوي يستخدم للتخلص من مشكلة الصراصير، يتم وضعه في المناطق التي تعتبر","ماكس فورس إس سي جل هو منتج فعال وقوي يستخدم للتخلص من مشكلة الصراصير، يتم وضعه في المناطق التي تعتبر جاذبة للصراصير, يضمن لك جل ماكس فورس التخلص السريع والدائم من الصراصير دون عناء",75.00,SAR,100,"https://media.zid.store/thumbs/7de0e23a-34de-4534-a0e6-ecf31aab83f7/c25039be-375c-44d6-a000-33de8dc8b713-thumbnail-1000x1000-70.jpg","",1,"","3300003",""
"تيبوشا مبيد فطري تيبوكونازول 25% لتر","اشتري الأن مبيد فطري تيبوكونازول25% لتر - مبيد يتميز بقدرته العلاجية والوقائية، ويتميز أيضًا بمكافحت","اشتري الأن مبيد فطري تيبوكونازول25% لتر - مبيد يتميز بقدرته العلاجية والوقائية، ويتميز أيضًا بمكافحته للأمراض، مثل البياض الدقيقي، عفن الجذور، الذبول",86.25,SAR,100,"https://media.zid.store/thumbs/7de0e23a-34de-4534-a0e6-ecf31aab83f7/3aa4a1c0-31c4-4c69-b418-c5c4eb498c09-thumbnail-1000x1000-70.jpg","",1,"","3100003",""
"برل هيومس برو ( هيوميك ألماني محبب ) 20 كيلو","برل هيومس برو هو هيوميك وفولفيك في صورة محببة بطيئة التحلل كسماد تأسيسي للتربة ( حمض الهيوميك 45 % و","برل هيومس برو هو هيوميك وفولفيك في صورة محببة بطيئة التحلل كسماد تأسيسي للتربة ( حمض الهيوميك 45 % وحمض الفولفيك 5 % ) مستخرج من فحم الليونارديت الطبيعي. وهو مادة بطيئة التحلل تستخدم للتأسيس قبل الزرا",145.00,SAR,100,"https://media.zid.store/thumbs/7de0e23a-34de-4534-a0e6-ecf31aab83f7/70df78d1-9950-4d92-a881-d39d89e46670-thumbnail-1000x1000.png","",1,"","Z.68552.1703081791809346",""
"اميدابرايد 200اس ال حجم 1 لتر","مبيد اميدابرايد 200اس المبيد حشري جهازي على هيئة سائل مركز قابل للذوبان يعمل بالملامسة و عن طريق الم","مبيد اميدابرايد 200اس المبيد حشري جهازي على هيئة سائل مركز قابل للذوبان يعمل بالملامسة و عن طريق المعدة .",86.25,SAR,100,"https://media.zid.store/thumbs/7de0e23a-34de-4534-a0e6-ecf31aab83f7/99d056dd-86bd-4a67-8a19-e8f85f890197-thumbnail-1000x1000-70.webp","",1,"","6285402339536",""
"تاج بست 25-25-18 سطل 20 كجم","يتميز سماد معجون تاج بست بأنه يحتوى على نسبة من البوتاسيوم، والتي تعمل على زيادة نسبة السكريات والكر","يتميز سماد معجون تاج بست بأنه يحتوى على نسبة من البوتاسيوم، والتي تعمل على زيادة نسبة السكريات والكربوهيدرات في الثمار, كما انه يتميز بدرجة حموضة منخفضة",143.75,SAR,100,"https://media.zid.store/thumbs/7de0e23a-34de-4534-a0e6-ecf31aab83f7/80e3bea4-2ebc-4c1e-b3bf-841cea0d55c5-thumbnail-1000x1000-70.jpg","",1,"","6285402334593",""
