اسم المنتج,الوصف القصير,الوصف الكامل,السعر,العملة,الكمية,الصورة,التصنيف,الحالة,المتغر,الباركود,الوزن
"ورد","أحصل الآن على بذور ورد من تاج الزراعية واستمتع بمنظر رائع ومميز من شكل بذور الورد، بالإضافة إلى الاس","أحصل الآن على بذور ورد من تاج الزراعية واستمتع بمنظر رائع ومميز من شكل بذور الورد، بالإضافة إلى الاستمتاع برائحتها المميزة، يمكنك الحصول عليها الآن بمجرد تأكيد الطلب لتصل إلى منزلك في غضون أيام.",5.00,SAR,100,"https://media.zid.store/thumbs/7de0e23a-34de-4534-a0e6-ecf31aab83f7/dac5f3da-0913-4a99-8cbb-da442fb7a0d2-thumbnail-1000x1000-70.jpeg","",1,"","Z.68552.1600255136567791",""
"سماد ماكس فيرت 17-10-27 + TE","احصد مكافآت زراعة ناجحة باستخدام سماد ماكس فيرت 17-10-27 TE من شركة تاج الزراعية. فعالية مثبتة في تح","احصد مكافآت زراعة ناجحة باستخدام سماد ماكس فيرت 17-10-27 TE من شركة تاج الزراعية. فعالية مثبتة في تحسين جودة المحصول.",184.00,SAR,100,"https://media.zid.store/thumbs/7de0e23a-34de-4534-a0e6-ecf31aab83f7/615acf33-bc82-48cf-8673-124ab3f998dc-thumbnail-1000x1000-70.jpeg","",1,"","1100036",""
"مكس فيرت 15-30-15+TE وزن 25 كيلو","مكس فيرت خليط من العناصر الكبرى والصغرى اللازمة لنمو وتطور النبات خلال مراحل نموه المختلفة، عبارة عن","مكس فيرت خليط من العناصر الكبرى والصغرى اللازمة لنمو وتطور النبات خلال مراحل نموه المختلفة، عبارة عن عالي الفوسفور لتحسين تشكل الجذور | أسمدة مركبة، شركة تاج الزراعية",212.75,SAR,100,"https://media.zid.store/thumbs/7de0e23a-34de-4534-a0e6-ecf31aab83f7/0cf67dab-ebb1-49aa-b63b-8919f7e175a6-thumbnail-1000x1000-70.jpeg","",1,"","1100035",""
"ماكس فيرت 10-10-40 +TE","ماكس فيرت 10-10-40 +TE، خليط من العناصر الكبرى والصغرى، اللازمة لنمو وتطور النبات خلال مراحل نموه ال","ماكس فيرت 10-10-40 +TE، خليط من العناصر الكبرى والصغرى، اللازمة لنمو وتطور النبات خلال مراحل نموه المختلفة | أسمدة مركبة، شركة تاج الزراعية",215.00,SAR,100,"https://media.zid.store/thumbs/7de0e23a-34de-4534-a0e6-ecf31aab83f7/501c136d-223b-4c40-b844-deef6db8327b-thumbnail-1000x1000-70.jpeg","",1,"","1100034",""
"سماد ماكس فيرة 15-15-30 +TE","سماد ماكس تركيبة متطورة تساعد على تحسين نمو النبات والإنتاج، عبارة عن نيتروجين فوسفور بوتاسيوم مع ال","سماد ماكس تركيبة متطورة تساعد على تحسين نمو النبات والإنتاج، عبارة عن نيتروجين فوسفور بوتاسيوم مع العناصر الصغرى | أسمدة مركبة، شركة تاج الزراعية",218.50,SAR,100,"https://media.zid.store/thumbs/7de0e23a-34de-4534-a0e6-ecf31aab83f7/70dcb7b4-e04d-421e-bf2f-fd627eb76fd3-thumbnail-1000x1000-70.jpeg","",1,"","1100033",""
"يوريا فوسفيت حامضي 17--44-0 وزن 25 كيلو","يوريا فوسفيت حامضي 17--44-0 يحتوي على تركيبة فريدة من اليوريا والفوسفور منخفض حموضة، مما يساعد على ت","يوريا فوسفيت حامضي 17--44-0 يحتوي على تركيبة فريدة من اليوريا والفوسفور منخفض حموضة، مما يساعد على تعزيز التغذية الفعالة | الأسمدة الآحادية، شركة تاج الزراعية",195.50,SAR,100,"https://media.zid.store/thumbs/7de0e23a-34de-4534-a0e6-ecf31aab83f7/b17f3ffa-9ec1-43e6-b239-fb466b989968-thumbnail-1000x1000-70.jpg","",1,"","1200100055",""
"بذور بنجر احمر ايطالي","بذور البنجر الأحمر الايطالي تُمثّل نوعًا من بذور البنجر ذات اللون الأحمر الجميل والشكل الإيطالي المم","بذور البنجر الأحمر الايطالي تُمثّل نوعًا من بذور البنجر ذات اللون الأحمر الجميل والشكل الإيطالي المميز | بذور خضار، شركة تاج الزراعية",5.00,SAR,100,"https://media.zid.store/thumbs/7de0e23a-34de-4534-a0e6-ecf31aab83f7/10a1bb43-fdf8-4152-ab51-03e59e916f9b-thumbnail-1000x1000-70.jpeg","",1,"","Z.68552.16002113058088253",""
"بذور قرع تندو عسلي طويل","بذور عالية الجودة لزراعة قرع تندو العسلي الطويل اللذيذ والمميز في النكهة والمظهر. يتميز قرع تندو الع","بذور عالية الجودة لزراعة قرع تندو العسلي الطويل اللذيذ والمميز في النكهة والمظهر. يتميز قرع تندو العسلي الطويل بشكله الجميل | بذور خضار، شركة تاج الزراعية",5.00,SAR,100,"https://media.zid.store/thumbs/7de0e23a-34de-4534-a0e6-ecf31aab83f7/f589f3f1-c0d4-4140-aed6-03cfcea81f39-thumbnail-1000x1000-70.jpeg","",1,"","Z.68552.16002112001565824",""
"بذور كوسا مدورة ايطالي 50 جرام","بذور عالية الجودة لزراعة كوسة مدورة ايطالية اللذيذة والمميزة في النكهة تتميز كوسا المدورة الايطالية ","بذور عالية الجودة لزراعة كوسة مدورة ايطالية اللذيذة والمميزة في النكهة تتميز كوسا المدورة الايطالية بشكلها المستدير ولونها الجميل | بذور خضار، شركة تاج الزراعية",26.45,SAR,100,"https://media.zid.store/thumbs/7de0e23a-34de-4534-a0e6-ecf31aab83f7/e575ac21-6358-4b0c-b010-0a7ed83ca6fa-thumbnail-1000x1000-70.jpeg","",1,"","5102800001",""
"بذور بروكلي ايطالي 50 جرام","بذور عالية الجودة لزراعة بروكلي الإيطالي اللذيذ والمغذي. يتميز بروكلي الإيطالي بأوراقه الكثيفة، مناس","بذور عالية الجودة لزراعة بروكلي الإيطالي اللذيذ والمغذي. يتميز بروكلي الإيطالي بأوراقه الكثيفة، مناسب للزراعة المنزلية والتجارية | بذور خضار، شركة تاج الزراعية",19.55,SAR,100,"https://media.zid.store/thumbs/7de0e23a-34de-4534-a0e6-ecf31aab83f7/1c65cb83-3ca9-48ef-a367-f9696a3c6d80-thumbnail-1000x1000-70.jpeg","",1,"","5100500003",""
"بروكلي","بذور بروكلي لذيذ ومغذي يعتبر خيارًا ممتازًا لمن يهتم بالتغذية الصحية ويرغب في إضافة الخضار والفيتامي","بذور بروكلي لذيذ ومغذي يعتبر خيارًا ممتازًا لمن يهتم بالتغذية الصحية ويرغب في إضافة الخضار والفيتامينات إلى نظامه الغذائي, بذور البروكلي ذو حجم مناسب وطعم طيب",5.00,SAR,100,"https://media.zid.store/thumbs/7de0e23a-34de-4534-a0e6-ecf31aab83f7/f029698c-2f90-4bc9-9ead-1763af51ae06-thumbnail-1000x1000-70.jpeg","",1,"","Z.68552.16002107427589376",""
"بذور بصل ابيض ليشبونه ايطالي ","بذور عالية الجودة لزراعة بصل أبيض ليشبونه الإيطالي اللذيذ والمميز في النكهة يتميز بصل ليشبونه بحجمه ","بذور عالية الجودة لزراعة بصل أبيض ليشبونه الإيطالي اللذيذ والمميز في النكهة يتميز بصل ليشبونه بحجمه الكبير ونكهته القوية والمميزة | بذور خضار، شركة تاج الزراعية",5.00,SAR,100,"https://media.zid.store/thumbs/7de0e23a-34de-4534-a0e6-ecf31aab83f7/babec92c-5b1a-4025-abce-37eece085ac1-thumbnail-1000x1000-70.jpeg","",1,"","Z.68552.16002102409585807",""
"بذور طماطم بلحية","بذور طماطم بلحية ايطالي للزراعة المكشوفة بلحية الشكل عالية الأنتاج","بذور طماطم بلحية ايطالي للزراعة المكشوفة بلحية الشكل عالية الأنتاج",5.00,SAR,100,"https://media.zid.store/thumbs/7de0e23a-34de-4534-a0e6-ecf31aab83f7/be761ff3-7e0c-4679-b236-77a247659b06-thumbnail-1000x1000-70.jpeg","",1,"","Z.68552.16002098461951504",""
"بذور كزبرة ايطالي 50 جرام","بذور الكزبرة الإيطالية تُمثّل نوعًا من بذور الكزبرة ذات الأصل الإيطالي، والتي تُستخدم عادة في الطهي ","بذور الكزبرة الإيطالية تُمثّل نوعًا من بذور الكزبرة ذات الأصل الإيطالي، والتي تُستخدم عادة في الطهي لإضافة نكهة مميزة وعطرية | بذور ورقيات، شركة تاج الزراعية",14.95,SAR,100,"https://media.zid.store/thumbs/7de0e23a-34de-4534-a0e6-ecf31aab83f7/d4301351-156e-41ab-a29e-06e1343e9f17-thumbnail-1000x1000-70.jpeg","",1,"","5102700002",""
"بذور باميا خضراء ايطالي 50 جرام","بذور عالية الجودة لزراعة بامية خضراء ايطالية طازجة ولذيذة. تتميز بامية ايطالية بثمارها الطويلة والخض","بذور عالية الجودة لزراعة بامية خضراء ايطالية طازجة ولذيذة. تتميز بامية ايطالية بثمارها الطويلة والخضراء الزاهية وقوامها الممتاز, تتميز بأنها غير معدلة وراثيًا و غير مهجنة وقدرتها على تحمل قلة الماء وا",14.95,SAR,100,"https://media.zid.store/thumbs/7de0e23a-34de-4534-a0e6-ecf31aab83f7/97d090e3-430f-44d5-958a-5e078583945e-thumbnail-1000x1000-70.jpeg","",1,"","5100300004",""
"بذور بقدونس 50 جرام","تتميز هذه البذور بالجودة العالية والنمو القوي والنكهة اللذيذة، استمتع بإضافة نكهة البقدونس الرائعة إ","تتميز هذه البذور بالجودة العالية والنمو القوي والنكهة اللذيذة، استمتع بإضافة نكهة البقدونس الرائعة إلى أطباقك المفضلة، سواء كانت سلطات، أعشاب مشكلة، أو وجبات طهي مختلفة | بذور ورقيات، شركة تاج الزراعي",14.95,SAR,100,"https://media.zid.store/thumbs/7de0e23a-34de-4534-a0e6-ecf31aab83f7/35f7e01c-adad-4a99-88e0-4bd81619a332-thumbnail-1000x1000-70.jpeg","",1,"","5100800001",""
"بذور خس ايطالي","بذر خس ايطالي اللذيذ والمميز في النكهة والقوام. يتميز خس ايطالي بأوراقه الخضراء الكبيرة, غير معدلة و","بذر خس ايطالي اللذيذ والمميز في النكهة والقوام. يتميز خس ايطالي بأوراقه الخضراء الكبيرة, غير معدلة وراثيًا ولم تتم معالجتها بمواد كيميائية, تتميز بجودة عالية وسعر بسيط",5.00,SAR,100,"https://media.zid.store/thumbs/7de0e23a-34de-4534-a0e6-ecf31aab83f7/0a1f2f16-57d4-4048-afdb-44c0f89bb496-thumbnail-1000x1000-70.jpeg","",1,"","Z.68552.160020809849",""
"بذور فجل احمر  ايطالي","فجل احمر ذو نمو ووتدي جيد الأوراق ذات طعم جيد وكذلك الجذر الوتدي تؤكل طازجه","فجل احمر ذو نمو ووتدي جيد الأوراق ذات طعم جيد وكذلك الجذر الوتدي تؤكل طازجه",5.00,SAR,100,"https://media.zid.store/thumbs/7de0e23a-34de-4534-a0e6-ecf31aab83f7/5be311d0-0dcf-4a2d-b707-4a8a8b56b5af-thumbnail-1000x1000-70.jpeg","",1,"","Z.68552.16002078163168979",""
"بذور لفت أيطالي","بذر لفت أيطالي عالي الجودة للزراعة الربيعية والخريفية بنسبة إنبات عالية وتغليف عالي الجودة","بذر لفت أيطالي عالي الجودة للزراعة الربيعية والخريفية بنسبة إنبات عالية وتغليف عالي الجودة",5.00,SAR,100,"https://media.zid.store/thumbs/7de0e23a-34de-4534-a0e6-ecf31aab83f7/0e15cf75-e3cd-432a-b5fc-ddc0d6243556-thumbnail-1000x1000-70.jpg","",1,"","Z.68552.16002077139723861",""
"مضخة 45 وات","مضخة 45 وات، احصل على كل ما تحتاجه من ادوات وقطع الكترونية او غيرها بأفضل الأسعار وأعلى الجودات الآن","مضخة 45 وات، احصل على كل ما تحتاجه من ادوات وقطع الكترونية او غيرها بأفضل الأسعار وأعلى الجودات الآن من تاج الزراعية | مضخات زراعية، شركة تاج الزراعية",34.50,SAR,100,"https://media.zid.store/thumbs/7de0e23a-34de-4534-a0e6-ecf31aab83f7/048ec05c-c8ec-4022-8962-26387aef714f-thumbnail-1000x1000-70.webp","",1,"","Z.68552.16050823524703047",""
"ملوخية بلدي 1 كيلو","تتميز هذه الملوخية بالجودة العالية والطعم الشهي والفوائد الصحية المتعددة. استمتع بتحضير وجبات شهية و","تتميز هذه الملوخية بالجودة العالية والطعم الشهي والفوائد الصحية المتعددة. استمتع بتحضير وجبات شهية ومغذية مع ملوخية بلدي الطازجة | بذور ورقيات، شركة تاج الزراعية",17.25,SAR,100,"https://media.zid.store/thumbs/7de0e23a-34de-4534-a0e6-ecf31aab83f7/4d2ff8ba-ee53-4735-8458-61013457d10e-thumbnail-1000x1000-70.jpg","",1,"","5103200001",""
"ملمع النباتات الداخلية","ملمع النباتات الدخلية من تاج الزراعية، يعيد لأوراق النباتات لمعتها الطبيعية ويغذيها ويبقيها حيه ونظر","ملمع النباتات الدخلية من تاج الزراعية، يعيد لأوراق النباتات لمعتها الطبيعية ويغذيها ويبقيها حيه ونظرة، عبوة 250 جرام, صنع في هولندا",23.00,SAR,100,"https://media.zid.store/thumbs/7de0e23a-34de-4534-a0e6-ecf31aab83f7/4ab87060-7a95-4aaf-bba5-129c34110177-thumbnail-1000x1000-70.jpeg","",1,"","1200300028",""
"مضخه 130 w","مضخة 130 واط ذات الأداء الممتاز لتلبية احتياجات مشاريعك حيث توفر القوة والكفاءة لتحقيق نتائج استثنائ","مضخة 130 واط ذات الأداء الممتاز لتلبية احتياجات مشاريعك حيث توفر القوة والكفاءة لتحقيق نتائج استثنائية ذات جودة مضمونة لضمان توفير مياه زراعية فعّالة | أجهزة الزراعة المائية، شركة تاج الزراعية",60.00,SAR,100,"https://media.zid.store/thumbs/7de0e23a-34de-4534-a0e6-ecf31aab83f7/83671c33-c000-44b0-aad3-7c5d35007ef6-thumbnail-1000x1000.png","",1,"","4200045",""
"مضخه 85 وات","مضخة ماء زراعية هي عبارة عن جزء أساسي في أنظمة الري الحديثة، وتوفر العديد من المزايا والمميزات التي ","مضخة ماء زراعية هي عبارة عن جزء أساسي في أنظمة الري الحديثة، وتوفر العديد من المزايا والمميزات التي تساعد في تحسين كفاءة الري وزيادة إنتاجية المحاصيل.",40.00,SAR,100,"https://media.zid.store/thumbs/7de0e23a-34de-4534-a0e6-ecf31aab83f7/a57f0dd5-0b33-41bf-833a-a9dfac198418-thumbnail-1000x1000-70.webp","",1,"","Z.68552.16043056143360736",""
"تيلماستر مبيد أعشاب (جلايفوسيت 48% )","تيلماستر (جلايفوسيت 48% ) مبيد أعشاب عام جهازي غير اختياري من تاج الزراعية، على هيئة سائل مركز قابل ","تيلماستر (جلايفوسيت 48% ) مبيد أعشاب عام جهازي غير اختياري من تاج الزراعية، على هيئة سائل مركز قابل للذوبان فى الماء | مبيدات أعشاب، شركة تاج الزراعية",44.00,SAR,100,"https://media.zid.store/thumbs/7de0e23a-34de-4534-a0e6-ecf31aab83f7/cf98e247-cb1c-4393-9d99-fbdc244fe4f8-thumbnail-1000x1000-70.jpeg","",1,"","3100006",""
"حجر بركاني ","hلحجر البركاني من تاج الزراعية، وسط زراعي بديل التربة يستخدم بخلطه مع تربة الأحواض من أجل تحسين قوام","hلحجر البركاني من تاج الزراعية، وسط زراعي بديل التربة يستخدم بخلطه مع تربة الأحواض من أجل تحسين قوام التربة | أجهزة الزراعة المائية، شركة تاج الزراعية",20.00,SAR,100,"https://media.zid.store/thumbs/7de0e23a-34de-4534-a0e6-ecf31aab83f7/1303744b-a3c1-4167-abf0-9afed82c71d8-thumbnail-1000x1000.png","",1,"","4200087",""
"زهور اجراتو","يمكنك الآن شراء بذور ورد ايطالي من متجر تاج الزراعية وزراعة حديقتك الخاصة أو الحديقة العامة بالزهور ","يمكنك الآن شراء بذور ورد ايطالي من متجر تاج الزراعية وزراعة حديقتك الخاصة أو الحديقة العامة بالزهور الإيطالية والتي تعتبر من أجمل الورود التي تتميز باللون الرائع والحجم الكبير، لا تفوت فرصة الشراء الآ",5.00,SAR,100,"https://media.zid.store/thumbs/7de0e23a-34de-4534-a0e6-ecf31aab83f7/45859e30-869c-4f01-a8e4-c3d006a5b302-thumbnail-1000x1000-70.jpeg","",1,"","Z.68552.1603274274661615",""
"زهور القطيفة","تعتبر بذور زهرة القطيفة واحدة من النباتات الزهرية الشائعة التي تُزرع لجمال زهورها وسهولة الزراعة، وي","تعتبر بذور زهرة القطيفة واحدة من النباتات الزهرية الشائعة التي تُزرع لجمال زهورها وسهولة الزراعة، ويمكنك الآن شرائها من خلال متجرنا تاج الزراعية، اغتنم الفرصة الآن",5.00,SAR,100,"https://media.zid.store/thumbs/7de0e23a-34de-4534-a0e6-ecf31aab83f7/96fcc45d-d8d3-4337-b978-60d6ebc9945a-thumbnail-1000x1000-70.jpeg","",1,"","Z.68552.16032734193612964",""
"محلول نبتة B2","محلول نبتة B2 للزراعة المائية الذي يساهم في تعزيز نمو النباتات وزيادة إنتاجيتها من تاج الزراعية، عبو","محلول نبتة B2 للزراعة المائية الذي يساهم في تعزيز نمو النباتات وزيادة إنتاجيتها من تاج الزراعية، عبوة 4 لتر | أسمدة الزراعة المائية، شركة تاج الزراعية",95.00,SAR,100,"https://media.zid.store/thumbs/7de0e23a-34de-4534-a0e6-ecf31aab83f7/77ade8aa-1699-401a-b4c0-a2bfeb7911d6-thumbnail-1000x1000-70.jpg","",1,"","1200500007",""
"محلول نبتة B1","محلول نبتة B1 لتعزيز النمو وتقوية صمود نباتاتك فهو محلول فعال ومبتكر يعمل على زيادة نمو النباتات وتح","محلول نبتة B1 لتعزيز النمو وتقوية صمود نباتاتك فهو محلول فعال ومبتكر يعمل على زيادة نمو النباتات وتحسين العائد الزراعي، اطلبه الآن ولا تفوت الفرصة | أسمدة الزراعة المائية، شركة تاج الزراعية",95.00,SAR,100,"https://media.zid.store/thumbs/7de0e23a-34de-4534-a0e6-ecf31aab83f7/f6179de3-8c48-4f58-80b2-ff6594c62a52-thumbnail-1000x1000-70.jpg","",1,"","1200500005",""
"محلول نبتة A","محلول نبتة A يُستخدم لري وتغذية النباتات من نوع A بالعناصر الغذائية اللازمة لنموها.اجعل مزرعتك أكثر ","محلول نبتة A يُستخدم لري وتغذية النباتات من نوع A بالعناصر الغذائية اللازمة لنموها.اجعل مزرعتك أكثر ثراءً وإنتاجية | أسمدة الزراعة المائية، شركة تاج الزراعية",95.00,SAR,100,"https://media.zid.store/thumbs/7de0e23a-34de-4534-a0e6-ecf31aab83f7/24fc2a01-7529-4204-9f27-a005450fb590-thumbnail-1000x1000-70.jpg","",1,"","1200500002",""
"محلول نبتة هووم","هذه المحاليل تحتوي على مجموعة من العناصر الغذائية الأساسية التي يحتاجها النبات لنموه، مفيدة لتوفير ت","هذه المحاليل تحتوي على مجموعة من العناصر الغذائية الأساسية التي يحتاجها النبات لنموه، مفيدة لتوفير تغذية للنباتات | أسمدة الزراعة المائية، شركة تاج الزراعية",35.00,SAR,100,"https://media.zid.store/thumbs/7de0e23a-34de-4534-a0e6-ecf31aab83f7/29fbe9d0-630b-41b7-8688-bb4995d3d5b9-thumbnail-1000x1000-70.jpg","",1,"","1200500001",""
"فيرتيمك 1.8 % SC ( مبيد حشري )","مبيد حشري سائل قابل للاستحلاب في الماء فعال يستخدم لمكافحة الحشرات الضارة في الزراعة والحدائق | المب","مبيد حشري سائل قابل للاستحلاب في الماء فعال يستخدم لمكافحة الحشرات الضارة في الزراعة والحدائق | المبيدات الحشرية، شركة تاج الزراعية",103.50,SAR,100,"https://media.zid.store/thumbs/7de0e23a-34de-4534-a0e6-ecf31aab83f7/47f0820c-4ef8-47bb-8d35-9bb550b4c62a-thumbnail-1000x1000-70.jpg","",1,"","3200088",""
"كوراجين 20% SC ( مبيد حشري )","كوراجين 20 SC هو مبيد حشري فعال يُستخدم لمكافحة الحشرات الضارة في الزراعة والحدائق، يعمل على التأثير","كوراجين 20 SC هو مبيد حشري فعال يُستخدم لمكافحة الحشرات الضارة في الزراعة والحدائق، يعمل على التأثير على جهاز عصب الحشرات | مبيد حشري، شركة تاج الزراعية",230.00,SAR,100,"https://media.zid.store/thumbs/7de0e23a-34de-4534-a0e6-ecf31aab83f7/5a217bf1-4c88-45c9-82c9-e3f2b2e132ae-thumbnail-1000x1000.png","",1,"","3200034",""
"تشيجازول 30% SL مبيد فطري حجم 1 لتر","تشيجازول 30% SL هو نوع من المبيدات الفطرية التي تُستخدم لمكافحة الفطريات الضارة في الزراعة والحدائق،","تشيجازول 30% SL هو نوع من المبيدات الفطرية التي تُستخدم لمكافحة الفطريات الضارة في الزراعة والحدائق، احصل عليه من تاج الزراعية | مبيدات فطرية، شركة تاج الزراعية",145.00,SAR,100,"https://media.zid.store/thumbs/7de0e23a-34de-4534-a0e6-ecf31aab83f7/b08ee19e-216b-4a69-bc4c-dbb613547790-thumbnail-1000x1000.png","",1,"","3400003",""
"الواح صفراء 10× 25 سم","احصل على لوح لاصق اصفر لمكافحة الحشرات الطائرة من متجر تاج بأعلى جودة وتخلص من الحشرات الطائرة تمامً","احصل على لوح لاصق اصفر لمكافحة الحشرات الطائرة من متجر تاج بأعلى جودة وتخلص من الحشرات الطائرة تمامًا. يتم تعليقه بالقرب من النبات، ويعمل على جذب الحشرات بسبب اللون الأصفر به",5.00,SAR,100,"https://media.zid.store/thumbs/7de0e23a-34de-4534-a0e6-ecf31aab83f7/f4ecf73b-5cb5-470a-98ea-c39c191f948d-thumbnail-1000x1000-70.jpeg","",1,"","4200190",""
"احواض الدتش بوكيت","احصل على احواض الدتش بوكيت لتحويل تجربة الزراعة إلى ممتعة وسهلة ،تصميمها العملي والمريح يسمح لك بزرا","احصل على احواض الدتش بوكيت لتحويل تجربة الزراعة إلى ممتعة وسهلة ،تصميمها العملي والمريح يسمح لك بزراعة النباتات بسهولة | أحواض زراعية، شركة تاج الزراعية",7.00,SAR,100,"https://media.zid.store/thumbs/7de0e23a-34de-4534-a0e6-ecf31aab83f7/5b88080f-bba7-4f8e-be64-8f85dc91c850-thumbnail-1000x1000-70.jpeg","",1,"","4200093",""
"محلول نبتة A","محلول نبتة A للزراعة المائية المتطور لتحسين نمو النباتات، تجربة فريدة تضمن محاصيل مزدهرة وصحة متميزة","محلول نبتة A للزراعة المائية المتطور لتحسين نمو النباتات، تجربة فريدة تضمن محاصيل مزدهرة وصحة متميزة من تاج الزراعية | أسمدة الزراعة المائية، شركة تاج الزراعية",35.00,SAR,100,"https://media.zid.store/thumbs/7de0e23a-34de-4534-a0e6-ecf31aab83f7/a30d9643-e37f-473f-8db5-dd4066d06060-thumbnail-1000x1000-70.jpg","",1,"","1200500003",""
